blog_post_id,lang_id,title,short_description,content,search_index,seo_title,seo_description,seo_keywords,og_title,og_description,remote_id,remote_slug
1,de,Willkommen in unserem Blog,"Dies ist unser erster Blogbeitrag. Wir freuen uns, Sie hier begrüßen zu dürfen.",<p>Herzlich willkommen auf unserem Blog! Hier finden Sie interessante Artikel zu verschiedenen Themen.</p><h2>Was Sie erwarten können</h2><p>Wir werden regelmäßig neue Beiträge veröffentlichen zu:</p><ul><li>Technologie-Trends</li><li>Best Practices</li><li>Tutorials und Anleitungen</li></ul><p>Bleiben Sie dran und <a href='https://example.com/subscribe'>abonnieren Sie unseren Newsletter</a>!</p>,Willkommen Blog erster Beitrag Technologie Trends,Willkommen | Unser Blog,Willkommen auf unserem Blog mit spannenden Artikeln zu Technologie und mehr.,"blog, willkommen, technologie",Willkommen in unserem Blog,Entdecken Sie unsere neuesten Blogbeiträge.,1001,/de/blog/willkommen/
1,fr,Bienvenue sur notre blog,Ceci est notre premier article de blog. Nous sommes ravis de vous accueillir ici.,<p>Bienvenue sur notre blog ! Vous trouverez ici des articles intéressants sur divers sujets.</p><h2>Ce que vous pouvez attendre</h2><p>Nous publierons régulièrement de nouveaux articles sur :</p><ul><li>Les tendances technologiques</li><li>Les meilleures pratiques</li><li>Tutoriels et guides</li></ul><p>Restez connecté et <a href='https://example.com/subscribe'>abonnez-vous à notre newsletter</a> !</p>,Bienvenue blog premier article technologie tendances,Bienvenue | Notre Blog,Bienvenue sur notre blog avec des articles passionnants sur la technologie et plus encore.,"blog, bienvenue, technologie",Bienvenue sur notre blog,Découvrez nos derniers articles de blog.,1002,/fr/blog/bienvenue/
2,de,10 Tipps für bessere Produktivität,"Entdecken Sie unsere besten Tipps, um Ihre tägliche Produktivität zu steigern.",<p>Produktivität ist der Schlüssel zum Erfolg. Hier sind unsere <strong>Top 10 Tipps</strong>:</p><h2>1. Planen Sie Ihren Tag</h2><p>Beginnen Sie jeden Morgen mit einer klaren To-Do-Liste.</p><h2>2. Eliminieren Sie Ablenkungen</h2><p>Schalten Sie Benachrichtigungen aus und schaffen Sie einen ruhigen Arbeitsplatz.</p><h3>Weitere Tipps</h3><p>Lesen Sie mehr in unserem <a href='https://example.com/ebook'>kostenlosen E-Book</a>.</p>,Produktivität Tipps Erfolg Planung Ablenkungen,10 Produktivitäts-Tipps | Blog,Steigern Sie Ihre Produktivität mit diesen 10 bewährten Tipps.,"produktivität, tipps, erfolg, planung",10 Tipps für bessere Produktivität,Verbessern Sie Ihre Arbeitsweise mit unseren Expertentipps.,1003,/de/blog/produktivitaet-tipps/
2,fr,10 conseils pour une meilleure productivité,Découvrez nos meilleurs conseils pour augmenter votre productivité quotidienne.,<p>La productivité est la clé du succès. Voici nos <strong>10 meilleurs conseils</strong> :</p><h2>1. Planifiez votre journée</h2><p>Commencez chaque matin avec une liste de tâches claire.</p><h2>2. Éliminez les distractions</h2><p>Désactivez les notifications et créez un espace de travail calme.</p><h3>Plus de conseils</h3><p>Lisez la suite dans notre <a href='https://example.com/ebook'>e-book gratuit</a>.</p>,productivité conseils succès planification distractions,10 Conseils Productivité | Blog,Augmentez votre productivité avec ces 10 conseils éprouvés.,"productivité, conseils, succès, planification",10 conseils pour une meilleure productivité,Améliorez votre façon de travailler avec nos conseils d'experts.,1004,/fr/blog/conseils-productivite/
3,de,Die Zukunft der künstlichen Intelligenz,Ein Blick auf die neuesten Entwicklungen und Trends im Bereich KI.,<p>Künstliche Intelligenz verändert unsere Welt rasant. In diesem Artikel betrachten wir die <em>wichtigsten Trends</em>.</p><h2>Machine Learning</h2><p>ML-Algorithmen werden immer leistungsfähiger und finden Anwendung in:</p><ul><li>Bildverarbeitung</li><li>Sprachverarbeitung</li><li>Predictive Analytics</li></ul><h2>Generative KI</h2><p>Von <strong>ChatGPT</strong> bis <strong>DALL-E</strong> – generative Modelle revolutionieren die Content-Erstellung.</p><p>Mehr erfahren Sie auf <a href='https://example.com/ai'>unserer KI-Seite</a>.</p>,KI künstliche Intelligenz Machine Learning Trends Zukunft,Zukunft der KI | Blog,Erfahren Sie alles über die neuesten KI-Trends und Entwicklungen.,"ki, künstliche intelligenz, machine learning, trends",Die Zukunft der künstlichen Intelligenz,Ein umfassender Überblick über KI-Trends.,1005,/de/blog/zukunft-ki/
3,fr,L'avenir de l'intelligence artificielle,Un aperçu des derniers développements et tendances dans le domaine de l'IA.,"<p>L'intelligence artificielle transforme rapidement notre monde. Dans cet article, nous examinons les <em>tendances les plus importantes</em>.</p><h2>Machine Learning</h2><p>Les algorithmes de ML deviennent de plus en plus puissants et trouvent des applications dans :</p><ul><li>Le traitement d'images</li><li>Le traitement du langage</li><li>L'analyse prédictive</li></ul><h2>IA Générative</h2><p>De <strong>ChatGPT</strong> à <strong>DALL-E</strong> – les modèles génératifs révolutionnent la création de contenu.</p><p>En savoir plus sur <a href='https://example.com/ai'>notre page IA</a>.</p>",IA intelligence artificielle Machine Learning tendances avenir,Avenir de l'IA | Blog,Découvrez les dernières tendances et développements en matière d'IA.,"ia, intelligence artificielle, machine learning, tendances",L'avenir de l'intelligence artificielle,Un aperçu complet des tendances de l'IA.,1006,/fr/blog/avenir-ia/
4,fr,Guide du débutant pour GraphQL,Apprenez les bases de GraphQL et comment l'utiliser dans vos projets.,<p>GraphQL est une alternative moderne aux APIs REST. Voici ce que vous devez savoir :</p><h2>Qu'est-ce que GraphQL ?</h2><p>GraphQL est un langage de requête pour les APIs développé par <strong>Facebook</strong>.</p><h2>Avantages</h2><ul><li>Récupérez exactement les données dont vous avez besoin</li><li>Une seule requête pour plusieurs ressources</li><li>Typage fort et documentation automatique</li></ul><p>Consultez notre <a href='https://example.com/graphql-tutorial'>tutoriel complet</a>.</p>,GraphQL API REST débutant guide tutoriel,Guide GraphQL Débutant | Blog,Apprenez GraphQL facilement avec notre guide pour débutants.,"graphql, api, tutoriel, débutant",Guide du débutant pour GraphQL,Maîtrisez GraphQL avec notre guide complet.,1007,/fr/blog/guide-graphql/
5,de,Headless CMS erklärt,Was ist ein Headless CMS und warum sollten Sie eines verwenden?,"<p>Ein <strong>Headless CMS</strong> trennt das Backend vom Frontend. Hier sind die Vorteile:</p><h2>Flexibilität</h2><p>Verwenden Sie jede Frontend-Technologie: React, Vue, Angular oder sogar mobile Apps.</p><h2>Omnichannel-Publishing</h2><p>Publizieren Sie Inhalte auf:</p><ul><li>Websites</li><li>Mobile Apps</li><li>IoT-Geräte</li><li>Digital Signage</li></ul><h3>Beliebte Headless CMS</h3><p>Zu den führenden Lösungen gehören <a href='https://hygraph.com'>Hygraph</a>, Contentful und Strapi.</p>",Headless CMS Frontend Backend Flexibilität Omnichannel,Headless CMS Erklärt | Blog,"Verstehen Sie, was ein Headless CMS ist und welche Vorteile es bietet.","headless cms, content management, api, frontend",Headless CMS erklärt,Alles über Headless CMS und seine Vorteile.,1008,/de/blog/headless-cms/
